id,state,title,description,technologies,reference_1,reference_2,reference_3,reference_4,reference_5,reference_6,reference_7,reference_8,reference_9,reference_10,last_update
6619,CA,State Transportation Plan,"The California Department of Transportation (Caltrans) must publish a
California Transportation Plan (Plan) every five years, beginning
December 31, 2020. The Plan must address how the state will achieve
maximum feasible emissions reductions, taking into consideration the use
of alternative fuels, new vehicle technology, and tailpipe emissions
reductions. Caltrans must consult and coordinate with related state
agencies, air quality management districts, public transit operators,
and regional transportation planning agencies. Caltrans must also
provide an opportunity for public input. Caltrans must submit a final
draft of the Plan to the legislature and governor. A copy of the 2020
report is available on the
[Caltrans](https://dot.ca.gov/programs/transportation-planning/state-planning/california-transportation-plan)
website. Caltrans must also review the Plan and prepare a report for the
legislature and governor that includes actionable, programmatic
transportation system improvement recommendations every five years.
(Reference [California Government
Code](https://leginfo.legislature.ca.gov/faces/home.xhtml) 65070-65073)
",ELEC,<a href = 'http://www.oal.ca.gov/' target = '_blank'>California Government Code 65071-65073</a>,NA,NA,NA,NA,NA,NA,NA,NA,NA,2022-12-25T15:18:49Z
8060,US,Alternative Fuel Labeling Requirements,"Retailers offering alternative fuel for sale must ensure dispensers are
labeled with information to help consumers make informed decisions about
fueling a vehicle, including the name of the fuel and the minimum
percentage of the main component of the fuel. Labels may also list the
percentage of other fuel components. This requirement applies to, but is
not limited to, the following fuel types: methanol, denatured ethanol,
and/or other alcohols; mixtures containing 85% or more by volume of
methanol and/or other alcohols; mixtures containing more than 10% but
less than 83% by volume of ethanol; natural gas; propane; hydrogen; coal
derived liquid biofuel; and electricity.

Fuel dispensers distributing biodiesel blends containing more than 5%
biodiesel by volume must include the percentage of biodiesel included.
For ethanol blends containing no greater than 50% ethanol by volume,
retailers must post the exact percentage of ethanol concentration,
rounded to the nearest multiple of 10. For ethanol blends containing
more than 50% but no greater than 83% ethanol by volume, retailers must
(1) post the exact percentage of ethanol concentration, (2) post the
percentage rounded to the nearest multiple of 10, or (3) post notice
that the fuel contains 51% to 83% ethanol.

Electric vehicle supply equipment (EVSE) manufacturers must determine
and disclose (via a delivery ticket or permanent label or marking)
kilowatt capacity, voltage, whether the voltage is alternating current
or direct current, amperage, and whether the system is conductive or
inductive.

(Reference 81 [Federal Register](https://www.federalregister.gov/) 2054
and 16 [CFR](https://www.govinfo.gov/) 306 and 309)
",ELEC,<a href = 'http://www.gpo.gov/fdsys' target = '_blank'>16 CFR 306 and 309</a>,<a href = 'https://www.federalregister.gov' target = '_blank'>81 Federal Register 2054</a>,NA,NA,NA,NA,NA,NA,NA,NA,2022-12-25T15:18:49Z
8161,CA,Plug-In Hybrid and Zero Emission Light-Duty Vehicle Rebates,"The Clean Vehicle Rebate Project (CVRP) offers rebates for the purchase
or lease of qualified vehicles. Qualified vehicles are light-duty
electric vehicles (EVs), fuel cell electric vehicles (FCEVs), and
plug-in hybrid electric vehicles (PHEVs) the California Air Resources
Board (CARB) has approved or certified. The rebates are for up to
\$4,500 for FCEVs, \$2,000 for EVs, \$1,000 for PHEVs, and \$750 for
zero emission motorcycles. Rebates are available on a first-come,
first-served basis to California residents who purchase or lease new
eligible vehicles. Residents of San Diego County may be eligible for a
preapproved rebate through the CVRP [Rebate
Now](https://cleanvehiclerebate.org/en/dealer/rebate-now) pilot.
Manufacturers must apply to CARB to have their vehicles included in the
CVRP.

Individuals are eligible for the rebate based on gross annual income, as
stated on the individual's federal tax return. Individuals with a gross
annual income below the following thresholds are eligible for all
rebates except those that apply to FCEVs:

-   \$135,000 for single filers
-   \$175,000 for head-of-household filers
-   \$200,000 for joint filers

For individuals with low and moderate household incomes of less than or
equal to 400% of the federal poverty level, rebates are increased by
\$2,500. Increased rebates are available for CARB-approved FCEVs, PHEVs,
and EVs. CARB must provide outreach to low income households and
communities to raise awareness about CVRP. Through January 1, 2022, CARB
must prioritize rebate payments for low income applicants.

CARB determines annual funding amounts for the CVRP, which is expected
to be effective through 2023. For more information, including
information on income verification, a list of eligible vehicles, and
instructions on how to apply, see the
[CVRP](https://cleanvehiclerebate.org/eng) webiste.

(Reference [California Health and Safety Code 44274 and 44258](http://www.oal.ca.gov/))",ELEC,"<a href = 'http://www.oal.ca.gov/' target = '_blank'>Assembly Bill 615, 2017</a>",<a href = 'http://www.oal.ca.gov/' target = '_blank'>California Health and Safety Code 44274 and 44258</a>,"<a href = 'http://leginfo.legislature.ca.gov/faces/home.xhtml' target = '_blank'>Assembly Bill 2885, 2018</a>",NA,NA,NA,NA,NA,NA,NA,2022-12-25T15:18:49Z
8220,WA,Low Carbon Fuel and Fuel-Efficient Vehicle Acquisition Requirement,"Washington state agencies must consider purchasing low carbon fuel
vehicles or converting conventional vehicles to use low carbon fuels
when financially comparable over the vehicle\'s useful life. Low carbon
fuels include hydrogen, biomethane, electricity, or natural gas blends
of at least 90%. State agencies must achieve an average fuel economy of
36 miles per gallon (mpg) for passenger vehicle fleets in motor pools
and leased conventional vehicles. State agencies must also purchase low
carbon fuel vehicles or, when purchasing new conventional vehicles,
achieve an average fuel economy of 40 mpg for light-duty passenger
vehicles and 27 mpg for light-duty vans and sport utility vehicles. When
calculating average fuel economy, emergency response vehicles, passenger
vans with a gross vehicle weight rating of 8,500 pounds or greater,
off-road vehicles, low carbon fuel vehicles, and vehicles driven less
than 2,000 miles per year are excluded. (Reference [Revised Code of
Washington](http://apps.leg.wa.gov/rcw/) 43.19.622)
",ELEC,<a href = 'http://apps.leg.wa.gov/rcw/' target = '_blank'>Revised Code of Washington 43.19.622</a>,NA,NA,NA,NA,NA,NA,NA,NA,NA,2022-12-25T15:18:49Z
8381,MD,Electric Vehicle (EV) and Fuel Cell Electric Vehicle (FCEV) Tax Credit,"Beginning July 1, 2023, qualified EV and FCEV purchasers may apply for
an excise tax credit of up to \$3,000. The tax credit is first-come,
first-served, and is limited to one vehicle per individual and 10
vehicles per business entity. Qualified vehicles must meet the following
criteria:

-   Have a total purchase price not exceeding \$50,000;
-   Be propelled to a significant extent by an electric motor that draws
    electricity from a battery with a capacity of at least 4
    kilowatt-hours;
-   Have not been modified from original manufacturer specifications;
    and
-   Be purchased and titled for the first time between July 1, 2023, and
    July 1, 2027.

Additional restrictions apply.

(Reference [Maryland Statutes, Transportation Code 13-815](https://mgaleg.maryland.gov/mgawebsite/Laws/Statutes) and [House Bill 1391, 2022](http://mgaleg.maryland.gov/webmga/frm1st.aspx?tab=home))",ELEC,"<a href = 'http://mgaleg.maryland.gov/webmga/frm1st.aspx?tab=home' target = '_blank'>Senate Bill 908, 2014, and </a>","<a href = 'https://mgaleg.maryland.gov/mgawebsite/Laws/Statutes' target = '_blank'>Maryland Statutes, Transportation Code 13-815</a>",<a href = 'http://mgaleg.maryland.gov/webmga/frm1st.aspx?tab=home' target = '_blank'>House Bill 406 2017</a>,"<a href = 'http://mgaleg.maryland.gov/webmga/frm1st.aspx?tab=home' target = '_blank'>House Bill 1246, 2019</a>","<a href = 'http://mgaleg.maryland.gov/webmga/frm1st.aspx?tab=home' target = '_blank'>House Bill 1391, 2022</a>",NA,NA,NA,NA,NA,2022-12-25T15:18:49Z
8382,MD,Electric Vehicle (EV) High Occupancy Vehicle (HOV) Lane Exemption,"Permitted EVs may operate in any Maryland HOV lanes regardless of the
number of occupants. Qualified EVs must have a maximum speed capability
of at least 65 miles per hour. To operate in HOV lanes, EV owners must
obtain a permit from the Maryland Department of Transportation Motor
Vehicle Administration (MDOT MVA). Each year the MDOT MVA and the State
Highway Administration must report EV use in HOV lanes to the governor.
This exemption expires September 30, 2022. For more information, see the
[HOV Permit Issuance for
EVs](https://mva.maryland.gov/about-mva/Pages/info/27300/27300-54T.aspx)
website.

(Reference [Maryland Statutes, Transportation Code 25-108 and 21-314](http://mgaleg.maryland.gov/webmga/frm1st.aspx?tab=home))",ELEC,"<a href = 'http://mgaleg.maryland.gov/webmga/frm1st.aspx?tab=home' target = '_blank'>Maryland Statutes, Transportation Code 25-108 and 21-314</a>","<a href = 'http://mgaleg.maryland.gov/webmga/frmMain.aspx?id=SB0033&stab=01&pid=billpage&tab=subject3&ys=2014RS' target = '_blank'>Senate Bill 33, 2014</a>","<a href = 'http://mgaleg.maryland.gov/webmga/frm1st.aspx?tab=home' target = '_blank'>House Bill 714, 2018</a>","<a href = 'http://mgaleg.maryland.gov/webmga/frm1st.aspx?tab=home' target = '_blank'>Senate Bill 70, 2019</a>",NA,NA,NA,NA,NA,NA,2022-12-25T15:18:49Z
8385,FL,Electric Vehicle (EV) Charging Station Financing Authorization,"Local governments may offer funding to property owners within their
jurisdiction to help finance EV charging station installations on their
property or enter into a financing agreement for the same purpose. For
additional information, property owners should contact their local
government. (Reference [Florida Statutes](http://www.flsenate.gov/Laws/)
163.08)
",ELEC,<a href = 'http://www.flsenate.gov/Laws/' target = '_blank'>Florida Statutes 163.08</a>,NA,NA,NA,NA,NA,NA,NA,NA,NA,2022-12-25T15:18:49Z
8400,AZ,Municipal Alternative Fuel Vehicle (AFV) Acquisition Requirements,"Local governments in Maricopa, Pinal, and Yavapai counties with a
population of more than 1.2 million people must develop and implement
vehicle fleet plans to encourage and increase the use of alternative
fuels in municipal fleets. At least 75% of the total municipal fleet
must operate on alternative fuels. Alternatively, municipal fleets may
meet AFV acquisition requirements through biodiesel or other alternative
fuel use or apply for waivers. Local governments in counties with
populations of more than 500,000 people with bus fleets must purchase or
convert buses to operate on alternative fuels. For the purpose of these
requirements, alternative fuels include propane, natural gas,
electricity, hydrogen, qualified diesel fuel substitutes, E85, and a
blend of hydrogen with propane or natural gas.

(Reference [Arizona Revised Statutes 9-500.04, 49-474.01, 49-541, and 49-571](http://www.azleg.state.az.us/))",ELEC,"<a href = 'http://www.azleg.state.az.us/' target = '_blank'>Arizona Revised Statutes 9-500.04, 49-474.01, 49-541, and 49-571</a>",NA,NA,NA,NA,NA,NA,NA,NA,NA,2022-12-25T15:18:49Z
8402,AZ,Federal Fleet Operation Regulations,"Federal fleets based in Arizona that operate primarily in counties with
a population of more than 1.2 million people must be comprised of at
least 90% alternative fuel vehicles. Alternatively, federal fleets may
meet acquisition requirements through alternative fuel use or apply for
waivers. For the purpose of these requirements, alternative fuels
include propane, natural gas, electricity, hydrogen, qualified diesel
fuel substitutes, and a blend of hydrogen with propane or natural gas.

(Reference [Arizona Revised Statutes 1-215 and 49-573](http://www.azleg.state.az.us/))",ELEC,<a href = 'http://www.azleg.state.az.us/' target = '_blank'>Arizona Revised Statutes 1-215 and 49-573</a>,NA,NA,NA,NA,NA,NA,NA,NA,NA,2022-12-25T15:18:49Z
8440,ME,Electric Vehicle (EV) Infrastructure Development,"Maine's smart grid infrastructure policy promotes the development,
implementation, availability, and use of smart grid technology. The
policy includes the goal of integrating advanced electric storage and
peak-reduction technologies, such as EVs, into the electric system.

(Reference [Maine Revised Statutes Title 35-A, Section 3143](http://www.mainelegislature.org/legis/statutes/))",ELEC,"<a href = 'http://www.mainelegislature.org/legis/statutes/' target = '_blank'>Maine Revised Statutes Title 35-A, Section 3143</a>",NA,NA,NA,NA,NA,NA,NA,NA,NA,2022-12-25T15:18:49Z
8482,HI,Electric Vehicle (EV) Charging Station Policies for Multi-Family Residences,"A multi-family residential dwelling or townhouse owner may install EV
charging stations on or near a parking stall at the dwelling as long as
the EV charging station is in compliance with applicable rules and
specifications, the EV charging station is registered with the private
entity within 30 days of installation, and the homeowner receives
consent from the private entity if the EV charging station is placed in
a common area. Private entities may adopt rules that restrict the
placement and use of EV charging station but may not charge a fee for
the placement. The EV charging station owner is responsible for any
damages resulting from the installation, maintenance, repair, removal,
or replacement of the EV charging station. A private entity includes
associations of homeowners, community associations, condominium
associations, cooperatives, or any nongovernmental entity with
covenants.

A working group within the Hawaii Department of Business, Economic
Development, and Tourism identified and examined the issues regarding
multi-family dwelling EV charging station requests to private entities.
The group [reported its
findings](https://files.hawaii.gov/dbedt/annuals/2015/2015-act-164-installation-of-ev-charging-stations.pdf)
and recommendations to the state legislature in December 2015.

(Reference [Hawaii Revised Statutes](http://www.capitol.hawaii.gov/)
196-7.5)
",ELEC,<a href = 'http://www.capitol.hawaii.gov/' target = '_blank'>Hawaii Revised Statutes 196-7.5</a>,"<a href = 'http://www.capitol.hawaii.gov/' target = '_blank'>Senate Bill 1416, 2015</a>",NA,NA,NA,NA,NA,NA,NA,NA,2022-12-25T15:18:49Z
8821,CA,Advanced Transportation Tax Exclusion,"The California Alternative Energy and Advanced Transportation Financing
Authority (CAEATFA) provides a sales and use tax exclusion for qualified
manufacturers of advanced transportation products, components, or
systems that reduce pollution and energy use and promote economic
development. Incentives are available until December 31, 2025. For more
information, including application materials, see the CAEATFA [Sales and
Use Tax Exclusion
Program](http://www.treasurer.ca.gov/caeatfa/ste/index.asp) website.
(Reference [California Public Resources
Code](https://leginfo.legislature.ca.gov/faces/home.xhtml%20)
26000-26017)
",ELEC,<a href = 'http://www.oal.ca.gov/' target = '_blank'>California Public Resources Code 26000-26017</a>,NA,NA,NA,NA,NA,NA,NA,NA,NA,2022-12-25T15:18:49Z
8842,CA,Electric Vehicle (EV) Infrastructure Information Resource,"The California Energy Commission, in consultation with the Public
Utilities Commission, must develop and maintain a website containing
specific links to electrical corporations, local publicly owned electric
utilities, and other websites that contain information specific to EVs,
including the following:

-   Resources to help consumers determine if their residences will
    require utility service upgrades to accommodate EVs;
-   Basic charging circuit requirements;
-   Utility rate options; and
-   Load management techniques.

(Reference [California Public Resources
Code](https://leginfo.legislature.ca.gov/faces/home.xhtml) 25227)
",ELEC,<a href = 'http://www.oal.ca.gov/' target = '_blank'>California Public Resources Code 25227</a>,NA,NA,NA,NA,NA,NA,NA,NA,NA,2022-12-25T15:18:49Z
8905,IL,School Bus Retrofit Reimbursement,"The Illinois Department of Education will reimburse any qualifying
school district for the cost of converting gasoline buses to more
fuel-efficient engines or to engines using alternative fuels.
Restrictions may apply.

(Reference [105 Illinois Compiled Statutes 5/29-5](http://www.ilga.gov/legislation/ilcs/ilcs.asp))",ELEC,<a href = 'http://www.ilga.gov/legislation/ilcs/ilcs.asp' target = '_blank'>105 Illinois Compiled Statutes 5/29-5</a>,NA,NA,NA,NA,NA,NA,NA,NA,NA,2022-12-25T15:18:49Z
8980,OH,Alternative Fuel Signage,"The Ohio Turnpike Commission allows businesses to place their logos on
directional signs within the right-of-way of state turnpikes. An
alternative fuel retailer may include a marking or symbol within their
logo indicating that it sells one or more types of alternative fuel.
Alternative fuels are defined as any fuel containing 85% or more ethanol
(E85), fuel blends containing at least 20% biodiesel (B20), natural gas,
propane, hydrogen, electricity, or any fuel that the U.S. Department of
Energy has determined is substantially not petroleum. For more
information, see the \[Ohio Turnpike Commission\](website.

(Reference [Ohio Revised Code 125.831 and 5537.30](https://codes.ohio.gov/ohio-revised-code))",ELEC,<a href = 'https://codes.ohio.gov/ohio-revised-code' target = '_blank'>Ohio Revised Code 125.831 and 5537.30</a>,NA,NA,NA,NA,NA,NA,NA,NA,NA,2022-12-25T15:18:49Z
9053,NM,Alternative Fuel Tax Exemption,"Alternative fuel distributed by or used for federal government, state
government, or Indian nation, tribe, or pueblo purposes is exempt from
the state excise tax. (Reference [New Mexico
Statutes](https://nmonesource.com/nmos/nmsa/en/nav_date.do) 7-16B-5)
",ELEC,<a href = 'http://www.nmonesource.com/nmnxtadmin/NMPublic.aspx' target = '_blank'>New Mexico Statutes 7-16B-5</a>,NA,NA,NA,NA,NA,NA,NA,NA,NA,2022-12-25T15:18:49Z
9097,UT,Propane and Electricity Tax Exemptions,"Propane and electricity used to operate motor vehicles are exempt from
state motor fuel taxes. For more information, see the Utah State Tax
Commission [Fuel Taxes](http://tax.utah.gov/fuel) website. (Reference
[Utah Code](http://le.utah.gov/xcode/code.html) 59-13-102, 59-13-201,
and 59-13-301)
",ELEC,"<a href = 'http://le.utah.gov/xcode/code.html' target = '_blank'>Utah Code 59-13-102, 59-13-201, and 59-13-301</a>",NA,NA,NA,NA,NA,NA,NA,NA,NA,2022-12-25T15:18:49Z
9154,WV,Alternative Fuel Use Requirement,"West Virginia higher education governing boards must use alternative
fuels to the maximum extent feasible. (Reference [West Virginia
Code](http://www.legis.state.wv.us/WVCODE/Code.cfm) 18B-5-9)
",ELEC,<a href = 'http://www.legis.state.wv.us/WVCODE/Code.cfm' target = '_blank'>West Virginia Code 18B-5-9</a>,NA,NA,NA,NA,NA,NA,NA,NA,NA,2022-12-25T15:18:49Z
9214,VA,Public Utility Definition,"An entity that is not a public utility, public service corporation, or
public service company that provides retail electric vehicle (EV)
charging services is not defined as a public utility and may sell
electricity if the electricity is used solely for transportation
purchases and the entity procured the electricity from an authorized
public utility. The Virginia State Corporation Commission may not set
the rates, charges, or fees for retail EV charging services provided by
non-utilities.

(Reference [House Bill 443, 2022](http://virginiageneralassembly.gov) and [Virginia Code 56-1.2:1 and 56-232.2:1](https://lis.virginia.gov))",ELEC,"<a href = 'http://lis.virginia.gov' target = '_blank'>Senate Bill 908, 2018</a>","<a href = 'http://virginiageneralassembly.gov' target = '_blank'>House Bill 443, 2022</a>",<a href = 'https://lis.virginia.gov' target = '_blank'>Virginia Code 56-1.2:1 and 56-232.2:1</a>,NA,NA,NA,NA,NA,NA,NA,2022-12-25T15:18:49Z
9292,ID,Electric Vehicle and Hybrid Electric Vehicle (HEV) Exemption from Vehicle Testing Requirements,"Electric vehicles, plug-in hybrid electric vehicles, and HEVs are exempt
from state motor vehicle inspection and maintenance programs. For more
information, see the [Idaho Vehicle Inspection
Program](https://idahovip.org/) website.

(Reference [Idaho Statutes 39-116B](https://legislature.idaho.gov/statutesrules/))",ELEC,<a href = 'https://legislature.idaho.gov/statutesrules/' target = '_blank'>Idaho Statutes 39-116B</a>,NA,NA,NA,NA,NA,NA,NA,NA,NA,2022-12-25T15:18:49Z
9296,TX,Electric Vehicle (EV) Charging Station Incentive - Austin Energy,"Austin Energy offers residential customers who own an electric vehicle a
rebate of 50% of the cost to purchase and install a qualified Level 2 EV
charging station, up to \$1,200. For more information, see the Austin
Energy [Home
Charging](https://austinenergy.com/ae/green-power/plug-in-austin/workplace-charging)
website.
",ELEC,<a href = 'https://austinenergy.com/ae/green-power/plug-in-austin/workplace-charging' target = '_blank'>Austin Energy</a>,NA,NA,NA,NA,NA,NA,NA,NA,NA,2022-12-25T15:18:49Z
9303,MD,Zero Emission Vehicle (ZEV) Infrastructure Promotion,"The Maryland Zero Emission Electric Vehicle Infrastructure Council
(ZEEVIC) promotes the use of promotes the use of ZEVs, including
electric vehicles (EVs) and fuel cell electric vehicles (FCEV), in the
state. Specific responsibilities of ZEEVIC include the following:

-   Develop policies and an action plan to promote and facilitate the
    integration of ZEVs into the Maryland transportation network;
-   Assist in developing and coordinating statewide standards for
    streamlined permitting and installation of electric vehicle charging
    and hydrogen fueling equipment;
-   Develop recommendations for a statewide EV charging and FCEV
    refueling infrastructure plan, including standard pricing
    information displays;
-   Increase and support consumer awareness and ownership of ZEVs
    through public outreach;
-   Recommend incentives to support private-sector investment in ZEVs;
-   Develop targeted policies to support fleet purchases of ZEVs;
-   Develop charging solutions for multiunit dwellings;
-   Encourage local and regional efforts to promote the use of ZEVs;
-   Develop model procurement practices for light-duty vehicles that
    include an evaluation of the vehicle lifecycle costs inclusive of
    estimated fuel cost over the anticipated life of the vehicle;
-   Recommend policies that support EV charging and FCEV fueling from
    clean energy sources;
-   Establish performance measures for meeting ZEV related employment,
    infrastructure, and regulatory goals; and
-   Pursue other policies, goals, and objectives that promote the
    adoption of ZEVs.

The Maryland Department of Transportation must provide staff support to
ZEEVIC with the assistance of the Maryland Energy Administration and the
Maryland Public Service Commission. For more information, including
interim reports, see the [Maryland Zero Emission Electric Vehicle
Infrastructure
Council](https://www.mdot.maryland.gov/tso/Pages/Index.aspx?PageId=81)
website and the [MarylandEV](http://www.marylandev.org) website.

(Reference [Chapter 378, Acts of 2015](http://mgaleg.maryland.gov/2015RS/chapters_noln/Ch_378_sb0714T.pdf), [Chapter 213, Acts of 2019](http://mgaleg.maryland.gov/2019RS/chapters_noln/Ch_213_hb1246E.pdf), and [Chapter 118, Acts of 2020](http://mgaleg.maryland.gov/2020RS/chapters_noln/Ch_118_hb0232T.pdf))",ELEC,"<a href = 'http://mgaleg.maryland.gov/webmga/frm1st.aspx?tab=home' target = '_blank'>Maryland Statutes, Transportation Code 11-145.1</a>","<a href = 'http://mgaleg.maryland.gov/webmga/frm1st.aspx?tab=home' target = '_blank'>House Bill 1246, 2019</a>","<a href = 'http://mgaleg.maryland.gov/webmga/frm1st.aspx?tab=home' target = '_blank'>House Bill 232, 2020</a>","<a href = 'http://mgaleg.maryland.gov/2015RS/chapters_noln/Ch_378_sb0714T.pdf' target = '_blank'>Chapter 378, Acts of 2015</a>","<a href = 'http://mgaleg.maryland.gov/2019RS/chapters_noln/Ch_213_hb1246E.pdf' target = '_blank'>Chapter 213, Acts of 2019</a>","<a href = 'http://mgaleg.maryland.gov/2020RS/chapters_noln/Ch_118_hb0232T.pdf' target = '_blank'>Chapter 118, Acts of 2020</a>",NA,NA,NA,NA,2022-12-25T15:18:49Z
9353,NC,High Occupancy Vehicle (HOV) Lane Exemption,"Qualified plug-in electric vehicles, dedicated natural gas vehicles, and
fuel cell electric vehicles may use North Carolina HOV lanes, regardless
of the number of occupants. This exemption expires September 30, 2025.
(Reference [North Carolina General
Statutes](http://www.ncleg.net/gascripts/Statutes/Statutes.asp) 20-4.01
and 20-146.2)
",ELEC,<a href = 'http://www.ncleg.net/gascripts/Statutes/Statutes.asp' target = '_blank'>North Carolina General Statutes 20-4.01 and 20-146.2</a>,NA,NA,NA,NA,NA,NA,NA,NA,NA,2022-12-25T15:18:49Z
9354,NC,Electric Vehicle (EV) and Fuel Cell Electric Vehicle (FCEV) Emissions Inspection Exemption,"Qualified light-duty EVs and FCEVs are exempt from state emissions
inspection requirements. Other restrictions may apply.

(Reference [North Carolina General Statutes 20-4.01 and 20-183.2](http://www.ncleg.net/gascripts/Statutes/Statutes.asp))",ELEC,<a href = 'http://www.ncleg.net/gascripts/Statutes/Statutes.asp' target = '_blank'>North Carolina General Statutes 20-4.01 and 20-183.2</a>,NA,NA,NA,NA,NA,NA,NA,NA,NA,2022-12-25T15:18:49Z
