id,state,title,description,technologies,reference_1,reference_2,reference_3,reference_4,reference_5,reference_6,reference_7,reference_8,reference_9,reference_10,last_update
11725,OK,Alternative Fuels Technician Certificates,"The Department of Labor (DOL) will issue a certificate to any person who
has successfully passed the appropriate alternative fuels equipment,
alternative fuels compression, or electric vehicle technician
examination as provided in the Alternative Fuels Technician
Certification Act. A certification fee applies. For companies,
partnerships, or corporations involved in the business of installing,
servicing, repairing, modifying, or renovating equipment used in
converting or modifying engines or fueling equipment to be used with
alternative fuels, DOL will issue a separate certificate. Alternative
fuels include propane, natural gas, methanol, ethanol, electricity,
hydrogen, biodiesel, and more.

DOL can issue an alternative fuels trainee certificate to any person who
submits a trainee application within 15 business days of being hired by
a licensed alternative fuels conversion or fueling station installation
company.

(Reference [Oklahoma Statutes](http://www.oklegislature.gov/index.aspx)
40-142.3 and 40-142.8)
",ELEC,<a href = 'http://www.oklegislature.gov/index.aspx' target = '_blank'>Oklahoma Statutes 40-142.8</a>,<a href = 'http://www.oklegislature.gov/index.aspx' target = '_blank'>Oklahoma Statutes 40-142.3</a>,NA,NA,NA,NA,NA,NA,NA,NA,2022-12-25T15:18:49Z
11734,NH,State Agency Electric Vehicle (EV) and EV Charging Station Procurement,"The state must pursue EV procurement opportunities for in the state
fleet and install EV charging stations for use by state agencies. Where
feasible and recommended by the State Government Energy Committee, state
offices with more than 50 employees may also make EV charging stations
available for employees, as long as energy cost is reimbursed by users.

(Reference [Executive Order 2016-03](https://sos.nh.gov/administration/miscellaneous/executive-orders/))",ELEC,<a href = 'https://sos.nh.gov/administration/miscellaneous/executive-orders/' target = '_blank'>Executive Order 2016-03</a>,NA,NA,NA,NA,NA,NA,NA,NA,NA,2022-12-25T15:18:49Z
11756,MA,Public Electric Vehicle (EV) Charging Station Requirements,"Owners and operators of public EV charging stations that require payment
must provide payment options that allow access by the public. In
addition, payment should not require users to pay a subscription fee or
obtain a membership of any kind; however, required fees may be
conditional on such memberships. Owners and operators can impose
reasonable restrictions on EV charging stations use, such as limiting
access to visitors of the business. In addition, owners and operators of
public EV charging stations must provide the location, hours of
operation, payment, and characteristics of each EV charging station to
the U.S. Department of Energy's Alternative Fuels Data Center.

(Reference [Massachusetts General Laws Chapter 25A, Section 16B-16E](http://www.malegislature.gov/Laws/GeneralLaws/))",ELEC,"<a href = 'https://malegislature.gov/' target = '_blank'>Senate Bill 2505, 2017</a>","<a href = 'http://www.malegislature.gov/Laws/GeneralLaws/' target = '_blank'>Massachusetts General Laws Chapter 25A, Section 16B-16E</a>",NA,NA,NA,NA,NA,NA,NA,NA,2022-12-25T15:18:49Z
11757,MA,Zero Emission Vehicle (ZEV) Parking Space Regulations,"A city or town may restrict certain parking areas for ZEVs, which
includes all-electric vehicles, plug-in hybrid electric vehicles, and
fuel cell vehicles. A person who is found responsible for a violation of
the restricted parking area may be subject to a penalty of no more than
\$50 and the vehicle may be removed from the parking spot.

(Reference [Massachusetts General Laws Chapter 40, Section 22A](http://www.malegislature.gov/Laws/GeneralLaws/))",ELEC,"<a href = 'https://malegislature.gov/' target = '_blank'>Senate Bill 2505, 2017</a>","<a href = 'http://www.malegislature.gov/Laws/GeneralLaws/' target = '_blank'>Massachusetts General Laws Chapter 40, Section 22A</a>",NA,NA,NA,NA,NA,NA,NA,NA,2022-12-25T15:18:49Z
11758,MA,Electric Vehicle (EV) Charging Station Building Standards,"At least one parking space in any new commercial construction with over
15 parking spaces must be made-ready for EV charging stations. An
EV-ready space is defined as a designated parking space with a dedicated
branch circuit for EV charging stations. Additional terms and conditions
apply.

(Reference [Massachusetts General Laws Chapter 143, Section 94 and 95](http://www.malegislature.gov/Laws/GeneralLaws/) and [Massachusetts State Building Code 780 CMR 13.00 Subsection C405.10](https://www.mass.gov/massachusetts-state-building-code-780-cmr))",ELEC,"<a href = 'https://malegislature.gov/' target = '_blank'>Senate Bill 2505, 2017</a>","<a href = 'http://www.malegislature.gov/Laws/GeneralLaws/' target = '_blank'>Massachusetts General Laws Chapter 143, Section 94 and 95</a>",<a href = 'https://www.mass.gov/massachusetts-state-building-code-780-cmr' target = '_blank'>Massachusetts State Building Code 780 CMR 13.00 Subsection C405.10</a>,NA,NA,NA,NA,NA,NA,NA,2022-12-25T15:18:49Z
11759,MA,Zero Emission Vehicle (ZEV) and Infrastructure Support,"Zero Emission Vehicle (ZEV) Commission is established to recommend
policies to expand access to ZEV infrastructure and to encourage the
purchase and lease of these vehicles. The ZEV Commission, comprised of
state agencies, is tasked with conducting ZEV feasibility studies on the
following topics:

-   Evaluating opportunities for electrification of the state fleet,
    including vehicles used by the regional transit authorities; and
-   Assessing surcharges, levies, or other assessments to offset
    projected gas tax revenue loss from the purchase or operation of
    ZEVs.

For more information, including available reports, see the [ZEV
Commission](https://www.mass.gov/service-details/zero-emission-vehicle-zev-commission)
website.

(Reference [Session LawChapter 448, Section 5 and 6, 2016](https://malegislature.gov/Laws/SessionLaws))",ELEC,"<a href = 'https://malegislature.gov/' target = '_blank'>Senate Bill 2505, 2017</a>","<a href = 'https://malegislature.gov/Laws/SessionLaws' target = '_blank'>Session LawChapter 448, Section 5 and 6, 2016</a>",NA,NA,NA,NA,NA,NA,NA,NA,2022-12-25T15:18:49Z
11767,VA,Public Entity Retail Electric Vehicle (EV) Infrastructure Authorization,"Any state government entity, as well as any locality, park authority,
public institution of higher education, or school boards, may operate
retail fee-based EV charging infrastructure on its property. A locality
may restrict use to employees of the locality and authorized visitors
and may install signage that details these restrictions. Retail
fee-based EV charging provided by state agencies must be offered at
rates similar to those in competitive areas. EV charging infrastructure
access must be restricted to employees, students, and authorized
visitors only during school hours, and must be accompanied by
appropriate signage.

(Reference [22.1-131, 56-1.2, 56-1.2:1, 56-232.2:1, and 2.2-614.5](http://lis.virginia.gov/000/src.htm) and [House Bill 443, 2022](http://virginiageneralassembly.gov/))",ELEC,"<a href = 'http://virginiageneralassembly.gov/' target = '_blank'>House Bill 2431, 2017</a>","<a href = 'http://lis.virginia.gov/000/src.htm' target = '_blank'>22.1-131, 56-1.2, 56-1.2:1, 56-232.2:1, and 2.2-614.5</a>","<a href = 'http://virginiageneralassembly.gov/' target = '_blank'>House Bill 1934, 2019</a>","<a href = 'http://virginiageneralassembly.gov/' target = '_blank'>House Bill 443, 2022</a>",NA,NA,NA,NA,NA,NA,2022-12-25T15:18:49Z
11768,UT,Alternative Fuel Vehicle Conversion Grants,"The Utah Conversion to Alternate Fuel Grant Program provides grants to
businesses and government entities that purchase clean vehicles or
install conversion equipment on eligible vehicles that allows the
vehicles to operate on alternative fuel or reduces a vehicle's emissions
of regulated pollutants. Award recipients are required to pass these
savings along to the individual who purchases the converted vehicle.
Grants may cover 100% of the cost of purchasing a clean vehicle or 50%
of the cost of conversion, up to \$2,500. Eligible clean vehicles must
operate solely on alternative fuel and include light- and heavy-duty
vehicles and off-road equipment. Eligible alternative fuels include
propane, natural gas, hydrogen, and electricity. For more information,
see the [Utah Conversion to Alternative Fuel Grant
Program](http://air.utah.gov/altfuel/index.php) website. (Reference
[Senate Bill](https://le.utah.gov/) 188, 2022, and [Utah
Code](http://le.utah.gov/xcode/code.html) 19-1-401 through 19-1-403.3
and 19-2-301 through 18-2-305)
",ELEC,"<a href = 'http://le.utah.gov/' target = '_blank'>House Bill 87, 2016</a>","<a href = 'http://le.utah.gov/xcode/code.html' target = '_blank'>Utah Code 19-1-401, 19-1-402, 19-1-403.3, and 19-1-405</a>","<a href = 'https://le.utah.gov/' target = '_blank'>Senate Bill 188, 2022</a>",NA,NA,NA,NA,NA,NA,NA,2022-12-25T15:18:49Z
11774,RI,Clean Diesel Grant ,"The Rhode Island Clean Diesel Fund provides companies with reimbursement
grants to reduce emissions from heavy-duty diesel vehicles. Qualified
vehicle improvements include vehicle replacements, engine repowers,
conversions to alternative vehicle fuels, idle reduction technologies,
and other fuel-efficient technologies. To be eligible, vehicles must be
registered with the Rhode Island Department of Motor Vehicles, and 50%
of the vehicle miles travelled or hours of operation must be in Rhode
Island for at least five years following receiving the grant. (Reference
[Rhode Island General
Laws](http://webserver.rilin.state.ri.us/Statutes/) 31-47.3-5.1)
",ELEC,"<a href = 'http://status.rilin.state.ri.us/' target = '_blank'>Senate Bill 3057, 2016</a>",<a href = 'http://webserver.rilin.state.ri.us/Statutes/' target = '_blank'>Rhode Island General Laws 31-47.3-5.1</a>,NA,NA,NA,NA,NA,NA,NA,NA,2022-12-25T15:18:49Z
11779,CA,Zero Emission Vehicle (ZEV) Fee,"ZEV owners must pay an annual road improvement fee of \$100 upon vehicle
registration or registration renewal for ZEVs model year 2020 and later.
The California Department of Motor Vehicles will increase the fee
annually to account for inflation, equal to the increase in the
California Consumer Price Index for the prior year. (Reference
[California Vehicle
Code](https://leginfo.legislature.ca.gov/faces/home.xhtml) 9250.6)
",ELEC,"<a href = 'http://leginfo.legislature.ca.gov/' target = '_blank'>Senate Bill 1, 2017</a>",NA,NA,NA,NA,NA,NA,NA,NA,NA,2022-12-25T15:18:49Z
11787,TN,Electric Vehicle (EV) Fee,"In addition to standard registration fees, EV owners must pay an annual
fee of \$100. Low-speed and medium-speed vehicles are exempt from the
fee.

(Reference [Tennessee Code 55-4-116](https://www.tncourts.gov/Tennessee%20Code))",ELEC,"<a href = 'http://wapp.capitol.tn.gov/apps/billsearch/BillSearchAdvanced.aspx' target = '_blank'>House Bill 534, 2017</a>",<a href = 'https://www.tncourts.gov/Tennessee%20Code' target = '_blank'>Tennessee Code 55-4-116</a>,NA,NA,NA,NA,NA,NA,NA,NA,2022-12-25T15:18:49Z
11803,WA,Alternative Fueling Infrastructure Grant Program,"The Washington State Department of Transportation (WSDOT) offers
competitive grants to strengthen and expand the [West Coast Electric
Highway](http://www.westcoastgreenhighway.com/WAelectrichighways.htm)
network by deploying Level 2 and direct current fast charging (DCFC)
electric vehicle (EV) chargers and hydrogen fueling infrastructure along
highway corridors in Washington. Eligible project costs include siting,
equipment purchases, electrical upgrades, installation, operations, and
maintenance. For more information, including funding availability and
application periods, see the WSDOT [Zero Emission Vehicle
Grants](https://wsdot.wa.gov/business-wsdot/grants/zero-emission-vehicle-grants)
website. (Reference [Revised Code of
Washington](http://apps.leg.wa.gov/rcw/) 47.04.350)
",ELEC,<a href = 'http://apps.leg.wa.gov/rcw/' target = '_blank'>Revised Code of Washington 47.04.350</a>,"<a href = 'http://leg.wa.gov/' target = '_blank'>House Bill 2042, 2019</a>",NA,NA,NA,NA,NA,NA,NA,NA,2022-12-25T15:18:49Z
11818,WV,Alternative Fuel Vehicle Fee,"In addition to standard registration fees, owners of vehicles fueled
with natural gas, hydrogen, or electricity must pay an annual fee of
\$200. Plug-in hybrid electric vehicle owners must pay an annual fee of
\$100. (Reference [West Virginia
Code](http://www.wvlegislature.gov/WVCODE/Code.cfm) 17A-10-3C)
",ELEC,"<a href = 'http://www.wvlegislature.gov/Bill_Status/bill_status.cfm' target = '_blank'>Senate Bill 1006, 2017</a>",<a href = 'http://www.legis.state.wv.us/WVCODE/Code.cfm' target = '_blank'>West Virginia Code 17A-10-3c</a>,NA,NA,NA,NA,NA,NA,NA,NA,2022-12-25T15:18:49Z
11820,TX,Authorization of Governmental Alternative Fuel Fleet Grant Program,"The Texas Commission on Environmental Quality (TCEQ) must administer a
grant program for governmental alternative fuel fleets to provide grants
for the purchase or lease of a new vehicle and the purchase, lease, or
installation of alternative fueling equipment. Eligible alternative
fuels include natural gas, propane, hydrogen, and electricity. State
agencies and political subdivisions are eligible to apply for a grant
under the program if the entity operates a fleet of more than 15
vehicles. Mass transit and school transportation providers will also be
eligible for grants.

TCEQ must establish standardized vehicle grant amounts based on the
incremental costs associated with the purchase or lease of different
categories of motor vehicle, including the fuel type, vehicle class, and
other categories TCEQ considers appropriate. TCEQ will also establish
standardized fueling equipment grant amounts.

(Reference [Texas Statutes](http://www.statutes.legis.state.tx.us/),
Health and Safety Code 386.153)
",ELEC,"<a href = 'http://www.capitol.state.tx.us/BillLookup/BillNumber.aspx' target = '_blank'>Senate Bill 1731, 2017</a>",NA,NA,NA,NA,NA,NA,NA,NA,NA,2022-12-25T15:18:49Z
11840,MN,All-Electric Vehicle (EV) Fee,"EVs are subject to an additional registration fee of \$75.

(Reference [Minnesota Statutes 168.013](https://www.revisor.mn.gov/pubs/))",ELEC,"<a href = 'https://www.leg.state.mn.us/' target = '_blank'>House Bill 3, 2017 </a>",<a href = 'https://www.revisor.mn.gov/pubs/' target = '_blank'>Minnesota Statutes 168.013</a>,NA,NA,NA,NA,NA,NA,NA,NA,2022-12-25T15:18:49Z
11844,SC,Alternative Fuel Vehicle Fee,"Owners of plug-in electric vehicles and fuel cell electric vehicles must
pay a biennial fee of \$120, in addition to standard registration fees.
Hybrid electric vehicle owners must pay a biennial fee of \$60.

(Reference [South Carolina Code of Laws 56-3-645 and 12-28-110(39))](https://www.scstatehouse.gov/code/statmast.php))",ELEC,<a href = 'https://www.scstatehouse.gov/code/statmast.php' target = '_blank'>South Carolina Code of Laws 56-3-645 and 12-28-110(39))</a>,NA,NA,NA,NA,NA,NA,NA,NA,NA,2022-12-25T15:18:49Z
11847,TX,Light-Duty Alternative Fuel Vehicle Rebates,"The Texas Commission on Environmental Quality (TCEQ) administers the
Light-Duty Motor Vehicle Purchase or Lease Incentive Program for the
purchase or lease of a new light-duty vehicle powered by compressed
natural gas (CNG), propane, hydrogen, or electricity. CNG and propane
vehicles, including bi-fuel vehicles, are eligible for a rebate of up to
\$5,000. Electric drive vehicles powered by a battery or hydrogen fuel
cell, including plug-in hybrid electric vehicles with a battery capacity
of at least 4 kilowatt hours, are eligible for a rebate of up to
\$2,500. One rebate is available per eligible vehicle. Rebates are
awarded on a first-come, first-served basis. For more information,
including eligibility requirements and the application form, see the
TCEQ [Texas Emissions Reduction
Plan](https://www.tceq.texas.gov/airquality/terp/ld.html) website.
(Reference [Texas Statutes](http://www.statutes.legis.state.tx.us/)
Health and Safety Code 386.17 and [Texas Administrative
Code](http://www.sos.state.tx.us/tac/index.shtml) 114.610-114.613)
",ELEC,"<a href = 'http://www.capitol.state.tx.us/BillLookup/BillNumber.aspx' target = '_blank'>Senate Bill 1731, 2017</a>","<a href = 'http://www.statutes.legis.state.tx.us/' target = '_blank'>Texas Statutes, Health and Safety Code 386</a>",<a href = 'http://www.sos.state.tx.us/tac/index.shtml' target = '_blank'>Texas Administrative Code 114.610-114.613</a>,NA,NA,NA,NA,NA,NA,NA,2022-12-25T15:18:49Z
11855,NV,Alternative Fuel Vehicle (AFV) and Infrastructure Grants Authorization,"The Nevada Office of Energy administers the Nevada Clean Energy Fund to
fund qualified clean energy projects, including any program, technology,
product, or service that supports the deployment of AFVs and related
infrastructure. Technologies that involve the combustion of fossil fuels
are not eligible for funding. For more information, see the [Nevada
Clean Energy Fund](https://nevadacef.org/) website. (Reference [Nevada
Revised Statutes](https://www.leg.state.nv.us/) 701B.930-995)
",ELEC,"<a href = 'https://www.leg.state.nv.us/' target = '_blank'>Senate Bill 407, 2017</a>",<a href = 'https://www.leg.state.nv.us/' target = '_blank'>Nevada Revised Statutes 701B.930-995</a>,NA,NA,NA,NA,NA,NA,NA,NA,2022-12-25T15:18:49Z
11856,NV,Electric Vehicle (EV) Charging Station Demonstration Program Requirements,"The Electric Vehicle Infrastructure Demonstration Program (Program)
requires Nevada utilities to promote and incentivize the deployment of
EV charging stations. Utility customers may include public schools that
install EV charging stations on-site or purchase electric school buses.
Incentives may cover up to 75% of the installation or purchase cost.

Utilities may request to recover the costs associated with carrying out
the Program, including customer incentives, by filing an application
with the Nevada Public Utilities Commission.

(Reference [Nevada Revised
Statutes](http://www.leg.state.nv.us/law1.cfm) 701B.670 and 704.110)
",ELEC,<a href = 'http://www.leg.state.nv.us/law1.cfm' target = '_blank'>Nevada Revised Statutes 701B and 704.110</a>,"<a href = 'https://www.leg.state.nv.us/' target = '_blank'>Senate Bill 299, 2019</a>",NA,NA,NA,NA,NA,NA,NA,NA,2022-12-25T15:18:49Z
11863,OR,Electric Vehicle and Vehicle Efficiency Fees,"All-electric vehicle owners must pay an annual fee of \$115 or a
per-mile road use fee of \$0.019 per mile through the OReGo program.
Medium-speed EV owners must pay an annual fee of \$63. Hybrid electric
vehicles and plug-in hybrid electric vehicles must pay an annual fee in
the following amounts:

::: {data-align=""center""}
  Vehicle Efficiency                                       Annual Fee
  ------------------------------------------------------- ------------
  Vehicles with a rating of 0-19 miles per gallon (mpg)       \$20
  Vehicles with a rating of 20-39 mpg                         \$25
  Vehicles with a rating of 40 mpg or greater                 \$35
:::

These fees are in addition to standard registration fees. Drivers with
electric vehicles or vehicles with ratings over 40 mpg are exempt from
additional registration fees if they enroll in the OReGo program. For
more information, including how to apply, visit the [OReGo
program](http://www.myorego.org/) website.

(Reference [Oregon Revised Statutes](https://www.oregonlegislature.gov/)
803.420 through 803.422)
",ELEC,<a href = 'https://www.oregonlegislature.gov/' target = '_blank'>Oregon Revised Statutes 803.420-803.422</a>,NA,NA,NA,NA,NA,NA,NA,NA,NA,2022-12-25T15:18:49Z
11865,OR,Clean School Bus Grants,"The Oregon Department of Environmental Quality must use funds awarded to
Oregon through the [Volkswagen (VW) Environmental Mitigation
Trust](https://www.epa.gov/enforcement/volkswagen-clean-air-act-civil-settlement)
and deposited in the Clean Diesel Engine Fund, to award grants to owners
and operators of at least 450 school buses powered by diesel engines.
Eligible vehicles include buses that have at least three years of
remaining useful life. Grants will be available for 30%, up to \$50,000,
for the purchase of a new bus or up to 100% of the cost to retrofit a
school bus with emissions-reducing parts or technology that reduce
diesel particulate matter emissions by at least 85%. Any money not
expended under this Clean Diesel Engine Fund will fund grants for the
reduction of diesel engine emissions as matching funds under the Diesel
Emissions Reduction Act program. For more information, see the [VW
Settlement](https://www.oregon.gov/deq/aq/programs/Pages/VW-Diesel-Settlement.aspx)
website. (Reference [Oregon Revised
Statutes](https://www.oregonlegislature.gov/) 468A.795 through 468A.807)
",ELEC,<a href = 'https://www.oregonlegislature.gov/' target = '_blank'>Oklahoma Revised Statutes 468A.795-468A.803</a>,"<a href = 'https://www.oregonlegislature.gov/' target = '_blank'>House Bill 2007, 2019</a>",NA,NA,NA,NA,NA,NA,NA,NA,2022-12-25T15:18:49Z
11867,RI,Electric Vehicle (EV) Charging Parking Restriction,"No person can stop, stand, or park a vehicle in a parking space where
there is a EV charging station and signage indicating that parking is
for EV charging only, unless the vehicle is connected to the charging
equipment. Violations will be subject to a fine of \$85. (Reference
[Rhode Island General
Laws](http://webserver.rilin.state.ri.us/Statutes/) 31-21-18 and
31-41.1-4)
",ELEC,"<a href = 'http://webserver.rilin.state.ri.us/Statutes/' target = '_blank'>Senate Bill 77, 2017</a>",<a href = 'http://webserver.rilin.state.ri.us/Statutes/' target = '_blank'>Rhode Island General Laws 31-21-18</a>,NA,NA,NA,NA,NA,NA,NA,NA,2022-12-25T15:18:49Z
11876,OR,Electric Vehicle (EV) Charging Station Policies for Rental Properties,"The tenant of a commercial space may apply to install EV charging
stations for the use of the tenant, employees of the tenant, and
customers of the tenant. Unless the premises does not have at least one
parking space per rental unit, the landlord must approve a completed
application no more than 60 days after the tenant submits the
application. In the absence of a different tenant-landlord agreement,
the EV charging stations will be personal property of the tenant and the
tenant is responsible for all costs associated with installation and use
of the EV charging station. The tenant is responsible for maintaining a
renter's liability insurance policy of at least \$100,000. Upon the
termination of the rental agreement, the landlord may require the tenant
to remove the charging station and restore the premises. Additional
requirements and restrictions apply. (Reference [Oregon Revised
Statutes](https://www.oregonlegislature.gov/) 90.462)
",ELEC,<a href = 'https://www.oregonlegislature.gov/' target = '_blank'>Oregon Revised Statutes 90.100- and 90.462</a>,NA,NA,NA,NA,NA,NA,NA,NA,NA,2022-12-25T15:18:49Z
11884,CA,Electric Vehicle (EV) Pilot Programs,"The California Public Utilities Commission (CPUC) may provide funding
for pilot utility programs to install EV charging stations at school
facilities, other educational institutions, and state parks or beaches.
Priority must be given to locations in disadvantaged communities, as
defined by the California Environmental Protection Agency. For more
information, see the CPUC project
[guidance](http://docs.cpuc.ca.gov/SearchRes.aspx?docformat=ALL&docid=206663987)
and the CPUC [Zero Emission Vehicles](http://www.cpuc.ca.gov/zev/)
website. (Reference [California Public Utilities
Code](http://leginfo.legislature.ca.gov/faces/home.xhtml) 740.13-740.14)
",ELEC,"<a href = 'http://leginfo.legislature.ca.gov/faces/home.xhtml' target = '_blank'>Assembly Bills 1082 and 1083, 2017</a>",<a href = 'http://leginfo.legislature.ca.gov/faces/home.xhtml' target = '_blank'>Public Utilities Code 740.13-740.14</a>,NA,NA,NA,NA,NA,NA,NA,NA,2022-12-25T15:18:49Z
11887,CA,Electric Vehicle (EV) Parking Space Regulation,"An individual may not park a motor vehicle within any on- or off-street
parking space specifically designated by a local authority for parking
and charging EVs unless the vehicle is a EV fueled by electricity.
Eligible EVs must be in the process of charging to park in the space. A
person found responsible for a violation is subject to traffic violation
penalties.

EV parking spaces count as at least one space toward minimum parking
requirements.

(Reference [California Vehicle
Code](http://leginfo.legislature.ca.gov/faces/home.xhtml) 22511)
",ELEC,"<a href = 'http://leginfo.legislature.ca.gov/faces/home.xhtml' target = '_blank'>Assembly Bill 1452, 2017</a>",<a href = 'http://leginfo.legislature.ca.gov/faces/home.xhtml' target = '_blank'>California Vehicle Code 22511</a>,"<a href = 'https://oal.ca.gov/' target = '_blank'>Assembly Bill 1100, 2019</a>",NA,NA,NA,NA,NA,NA,NA,2022-12-25T15:18:49Z
11888,CA,Zero-Emission and Autonomous Vehicle Infrastructure Support,"Cities and counties that receive funding from the Road Maintenance and
Rehabilitation Program are encouraged to use funds towards advanced
transportation technologies and communication systems, including, but
not limited to, zero-emission vehicle fueling infrastructure and
infrastructure-to-vehicle communications for autonomous vehicles.
(Reference [California Streets and Highways
Code](http://leginfo.legislature.ca.gov/faces/home.xhtml) 2030)
",ELEC,"<a href = 'http://leginfo.legislature.ca.gov/faces/home.xhtml' target = '_blank'>Senate Bill 1, 2017</a>",<a href = 'http://leginfo.legislature.ca.gov/faces/home.xhtml' target = '_blank'>California Streets and Highways Code 2030</a>,NA,NA,NA,NA,NA,NA,NA,NA,2022-12-25T15:18:49Z
